id,title,description,content,source,publishedAt,URL,imgURL,category
154,Lose Weight and Prevent Sickness: Scientists Uncover Surprising Health Benefits of Drinking Plenty of Water - SciTechDaily,"In the first systematic look, UC San Francisco researchers have discovered that drinking water benefits a range of conditions, including obesity and migraines. Public health recommendations generally suggest drinking eight cups of water a day. And many people…","A UCSF study found that drinking adequate water can prevent kidney stones, aid weight loss, and improve conditions like migraines, diabetes, UTIs, and low blood pressure, though water needs vary by i… [+3399 chars]",SciTechDaily,2024-12-04 14:06:16,https://scitechdaily.com/lose-weight-and-prevent-sickness-scientists-uncover-surprising-health-benefits-of-drinking-plenty-of-water/,https://scitechdaily.com/images/More-Drinking-Water.jpg,Health
155,Microsoft’s New Update—Bad News Confirmed For 400 Million Windows Users - Forbes,Microsoft’s security nightmare is coming true—here’s what you need to know.,"Bad news suddenly hits Microsoft 
NurPhoto via Getty Images
Republished on December 4 with Microsofts confirmation on update restrictions.
Microsoft has a surprising new problem on its hands as it… [+5071 chars]",Forbes,2024-12-04 14:26:15,https://www.forbes.com/sites/zakdoffman/2024/12/04/microsofts-bad-news-15-million-windows-users-now-at-risk/,"https://imageio.forbes.com/specials-images/imageserve/6695f3f83a87798d607daf59/0x0.jpg?format=jpg&crop=2499,1531,x443,y345,safe&height=900&width=1600&fit=bounds",Technology
156,Nuclear Hearts Of NASA’s Voyager Probes Are Dying Taking The Crafts With Them - Jalopnik,"NASA’s ancient Voyager probes run on nuclear batteries that are running out of juice, so systems are being shut down one by one to eke out power","After launching into space almost 50 years ago, NASAs Voyager probes are reaching the end of their lives. The nuclear batteries onboard the two spacecraft are running out of juice, which means NASA i… [+3067 chars]",Jalopnik,2024-12-04 14:20:00,https://jalopnik.com/nuclear-hearts-of-nasa-s-voyager-probes-are-dying-takin-1851713066,"https://i.kinja-img.com/image/upload/c_fill,h_675,pg_1,q_80,w_1200/e622cb76734b8c18cba34a724b90d71f.jpg",Technology
157,"National signing day live: Commits, flips, rumors and best moments - ESPN","We''re tracking the latest news, rumors and class rankings updates on signing day.",College football's national signing day has kicked off with the early signing period. Class of 2025 high school recruits are now able to sign their national letters of intent to lock them into the co… [+653 chars],ESPN,2024-12-04 16:15:00,https://www.espn.com/college-football/recruiting/story/_/id/42648155/college-football-signing-day-2025-class-live-commits-flips-rumors-best-moments,https://a.espncdn.com/combiner/i?img=%2Fphoto%2F2024%2F1204%2Fr1423384_1296x729_16%2D9.jpg,E-Sports
158,Why Za’Darius Smith must take down his former team in Green Bay - Pride Of Detroit,"Taking on the Green Bay Packers, Detroit Lions defensive end Za’Darius Smith has a chance to get revenge against his former team and boost Detroit’s divisional lead.","The NFC North is easily the best division in the NFL right now. The Detroit Lions have the lead with an 11-1 record, but the Minnesota Vikings and the Green Bay Packers are right behind them. The Vik… [+4031 chars]",Prideofdetroit.com,2024-12-04 12:30:00,https://www.prideofdetroit.com/2024/12/4/24309161/why-detroit-lions-zadarius-smith-must-have-big-revenge-game-against-green-bay-packers,https://cdn.vox-cdn.com/thumbor/-kdOEUbQ7T_J-5eieNSCNQuf8ls=/0x345:5735x3348/fit-in/1200x630/cdn.vox-cdn.com/uploads/chorus_asset/file/25765679/usa_today_24785585.jpg,E-Sports
159,ESPN is coming to the Disney Plus app starting today - The Verge,Disney Plus is bringing ESPN’s content to the popular streaming app so bundle subscribers can stream everything in one place.,"ESPN is coming to the Disney Plus app starting today
ESPN is coming to the Disney Plus app starting today
 / For now its just games and events from ESPN Plus. But next year, the real ESPN will be t… [+3289 chars]",The Verge,2024-12-04 15:00:00,https://www.theverge.com/2024/12/4/24312617/espn-disney-plus-now-available-bundle-free-preview,https://cdn.vox-cdn.com/thumbor/bXrztA7sOgXI262LqjhJ_sMPRLY=/0x0:2911x2183/1200x628/filters:focal(1456x1092:1457x1093)/cdn.vox-cdn.com/uploads/chorus_asset/file/25772407/disneyespn.jpg,E-Sports
